{
  "schemaVersion": 1,
  "revision": 4,
  "generatedAt": "2026-08-23T16:40:22.977Z",
  "routes": [
    {
      "id": "youtube",
      "name": "YouTube",
      "hosts": [
        "www.youtube.com",
        "m.youtube.com",
        "youtube.com",
        "img.youtube.com",
        "www.youtu.be",
        "youtu.be",
        "www.youtube-nocookie.com",
        "youtube-nocookie.com"
      ],
      "hostPatterns": [],
      "frontends": [
        {
          "id": "cloudtube",
          "name": "CloudTube",
          "strategy": {
            "type": "replace-origin"
          },
          "instances": [
            "https://tube.cadence.moe",
            "https://tube.boritsch.de"
          ]
        },
        {
          "id": "invidious",
          "name": "Invidious",
          "strategy": {
            "type": "replace-origin"
          },
          "instances": [
            "https://inv.nadeko.net",
            "https://invidious.nerdvpn.de",
            "https://invidious.f5.si",
            "https://yt.chocolatemoo53.com",
            "https://invidious.tiekoetter.com",
            "https://inv-ygg.nadeko.net",
            "https://inv.nadeko.ygg"
          ]
        },
        {
          "id": "piped",
          "name": "Piped",
          "strategy": {
            "type": "replace-origin"
          },
          "instances": [
            "https://adminforge.de",
            "https://drgns.space",
            "https://piped.private.coffee"
          ]
        },
        {
          "id": "piped-material",
          "name": "Piped-Material",
          "strategy": {
            "type": "replace-origin"
          },
          "instances": [
            "https://piped-material.xn--17b.net",
            "https://piped-material.ftp.sh",
            "https://eds-v2.piped.xn--17b.net"
          ]
        }
      ]
    },
    {
      "id": "youtube-1",
      "name": "YouTube (additional hosts)",
      "hosts": [
        "i.ytimg.com",
        "s.ytimg.com"
      ],
      "hostPatterns": [],
      "frontends": [
        {
          "id": "invidious",
          "name": "Invidious",
          "strategy": {
            "type": "replace-origin"
          },
          "instances": [
            "https://inv.nadeko.net",
            "https://invidious.nerdvpn.de",
            "https://invidious.f5.si",
            "https://yt.chocolatemoo53.com",
            "https://invidious.tiekoetter.com",
            "https://inv-ygg.nadeko.net",
            "https://inv.nadeko.ygg"
          ]
        }
      ]
    },
    {
      "id": "youtube-music",
      "name": "YT Music",
      "hosts": [
        "music.youtube.com"
      ],
      "hostPatterns": [],
      "frontends": [
        {
          "id": "hyperpipe",
          "name": "Hyperpipe",
          "strategy": {
            "type": "replace-origin"
          },
          "instances": [
            "https://hyperpipe.surge.sh",
            "https://music.adminforge.de",
            "https://music.pfcd.me",
            "https://hyperpipe.frontendfriendly.xyz",
            "https://hyperpipe.drgns.space",
            "https://hyperpipe.projectsegfau.lt",
            "https://hp.ggtyler.dev",
            "https://hyperpipe.lunar.icu",
            "https://hp.iqbalrifai.eu.org",
            "https://hp.ngn.tf",
            "https://hyperpipe.ducks.party",
            "https://hyperpipe.darkness.services"
          ]
        }
      ]
    },
    {
      "id": "twitter",
      "name": "Twitter",
      "hosts": [
        "www.twitter.com",
        "mobile.twitter.com",
        "twitter.com",
        "www.x.com",
        "mobile.x.com",
        "x.com",
        "pbs.twimg.com",
        "video.twimg.com",
        "platform.x.com",
        "platform.twitter.com",
        "t.co"
      ],
      "hostPatterns": [],
      "frontends": [
        {
          "id": "nitter",
          "name": "Nitter",
          "strategy": {
            "type": "replace-origin"
          },
          "instances": [
            "https://xcancel.com",
            "https://nitter.poast.org",
            "https://nitter.privacyredirect.com",
            "https://lightbrd.com",
            "https://nitter.space",
            "https://nitter.tiekoetter.com",
            "https://nuku.trabun.org",
            "https://nitter.catsarch.com",
            "https://nitter.kareem.one"
          ]
        }
      ]
    },
    {
      "id": "chat-gpt",
      "name": "ChatGPT",
      "hosts": [
        "chatgpt.com"
      ],
      "hostPatterns": [],
      "frontends": [
        {
          "id": "original",
          "name": "Original site",
          "strategy": {
            "type": "passthrough"
          }
        }
      ]
    },
    {
      "id": "bluesky",
      "name": "Bluesky",
      "hosts": [
        "bsky.app"
      ],
      "hostPatterns": [],
      "frontends": [
        {
          "id": "original",
          "name": "Original site",
          "strategy": {
            "type": "passthrough"
          }
        }
      ]
    },
    {
      "id": "reddit",
      "name": "Reddit",
      "hosts": [
        "www.reddit.com",
        "old.reddit.com",
        "np.reddit.com",
        "new.reddit.com",
        "amp.reddit.com",
        "reddit.com"
      ],
      "hostPatterns": [
        "^((i|(external-)?preview)\\.)?redd\\.it$"
      ],
      "frontends": [
        {
          "id": "redlib",
          "name": "Redlib",
          "strategy": {
            "type": "replace-origin"
          },
          "instances": [
            "https://safereddit.com",
            "https://redlib.catsarch.com",
            "https://red.artemislena.eu",
            "https://redlib.cow.rip",
            "https://redlib.privadency.com"
          ]
        }
      ]
    },
    {
      "id": "tumblr",
      "name": "Tumblr",
      "hosts": [
        "media.tumblr.com",
        "assets.tumblr.com",
        "static.tumblr.com",
        "tumblr.com"
      ],
      "hostPatterns": [
        "^[0-9]+\\.media\\.tumblr\\.com$",
        "^(www\\.)?([a-zA-Z0-9-]+)\\.tumblr.com$"
      ],
      "frontends": [
        {
          "id": "priviblur",
          "name": "Priviblur",
          "strategy": {
            "type": "replace-origin"
          },
          "instances": [
            "https://pb.bloat.cat",
            "https://tb.opnxng.com",
            "https://priviblur.pussthecat.org",
            "https://priviblur.thebunny.zone",
            "https://priviblur.canine.tools",
            "https://pb.cleberg.net",
            "https://tumblr.nerdvpn.de",
            "https://pb.proxik.cloud",
            "https://priviblur.privadency.com"
          ]
        }
      ]
    },
    {
      "id": "twitch",
      "name": "Twitch",
      "hosts": [
        "www.twitch.tv",
        "www.twitch.com",
        "clips.twitch.tv",
        "clips.twitch.com",
        "twitch.tv",
        "twitch.com"
      ],
      "hostPatterns": [],
      "frontends": [
        {
          "id": "safetwitch",
          "name": "SafeTwitch",
          "strategy": {
            "type": "replace-origin"
          },
          "instances": [
            "https://safetwitch.drgns.space",
            "https://ttv.vern.cc",
            "https://twitch.sudovanilla.org",
            "https://safetwitch.ducks.party",
            "https://safetwitch.nogafam.fr",
            "https://safetwitch.privacyredirect.com",
            "https://safetwitch.darkness.services",
            "https://safetwitch.4o1x5.dev",
            "https://safetwitch.adminforge.de",
            "https://twitch.blitzw.in",
            "https://safetwitch.canine.tools",
            "https://safetwitch.privadency.com"
          ]
        },
        {
          "id": "twineo",
          "name": "Twineo",
          "strategy": {
            "type": "replace-origin"
          },
          "instances": [
            "https://twineo.exozy.me",
            "https://twineo.drgns.space"
          ]
        }
      ]
    },
    {
      "id": "tiktok",
      "name": "TikTok",
      "hosts": [
        "www.tiktok.com",
        "tiktok.com"
      ],
      "hostPatterns": [],
      "frontends": [
        {
          "id": "proxi-tok",
          "name": "ProxiTok",
          "strategy": {
            "type": "replace-origin"
          },
          "instances": [
            "https://proxitok.pabloferreiro.es",
            "https://proxitok.pussthecat.org",
            "https://tok.habedieeh.re",
            "https://proxitok.privacydev.net",
            "https://tok.artemislena.eu",
            "https://tok.adminforge.de",
            "https://cringe.whatever.social",
            "https://proxitok.lunar.icu",
            "https://proxitok.privacy.com.de",
            "https://cringe.seitan-ayoub.lol",
            "https://tt.opnxng.com",
            "https://tiktok.wpme.pl",
            "https://proxitok.r4fo.com",
            "https://proxitok.belloworld.it"
          ]
        }
      ]
    },
    {
      "id": "instagram",
      "name": "Instagram",
      "hosts": [
        "www.instagram.com",
        "instagram.com"
      ],
      "hostPatterns": [],
      "frontends": [
        {
          "id": "kittygram",
          "name": "kittygram",
          "strategy": {
            "type": "replace-origin"
          },
          "instances": [
            "https://kittygr.am",
            "https://kittygram.irelephant.net",
            "https://kittygram.nexussfan.cz",
            "https://kittygram.kareem.one",
            "https://kg.lus.lu",
            "https://kg.meowing.de",
            "https://kittygram.nadeko.net",
            "https://kittygram.pussthecat.org"
          ]
        },
        {
          "id": "proxigram",
          "name": "Proxigram",
          "strategy": {
            "type": "replace-origin"
          },
          "instances": [
            "https://ig.opnxng.com",
            "https://proxigram.lunar.icu",
            "https://gram.whatever.social",